entry_fee_foreign_inr,open_hours_tue,description,open_hours_sat,last_verified,famous_for,access,entry_fee_child_indian_inr,connectivity,district,distance_from,visitor_tips,tips,seasonal_hours,nearby_attractions,suitable_for,lng,food_specialties,entry_fee_adult,aka,entry_fee_adult_indian_inr,open_hours_sun,stay_and_food,accessibility,taluka,avg_visit_mins,open_hours_fri,entry_fee_camera_fee_inr,open_hours_mon,temple,name,best_months,entry_fee_child,open_hours_wed,state,location,notes,id,lat,rating,city,type,village,disclaimer,entry_fee_foreign,open_hours_thu,festival_crowds,heritage,fees,darshan_timings,country,highlights,tags
,09:00-17:00,"A scenic perennial waterfall inside Shoolpaneshwar Wildlife Sanctuary, around 12–15 km from the Statue of Unity, popular for short treks, picnics, and monsoon visits with clear plunge pools.",09:00-17:00,2025-09-01,"forest trek setting, proximity to Statue of Unity, monsoon flow",,,,,,,,,"['Statue of Unity', 'Shoolpaneshwar Temple', 'Gheer Khadi']",,73.642,,50,,,09:00-17:00,,"{'wheelchair': False, 'public_transport': True, 'parking': True}",,120,09:00-17:00,,09:00-17:00,,Zarwani Waterfalls,"Jul, Aug, Sep, Oct, Nov",50,09:00-17:00,Gujarat,,Inside a wildlife sanctuary; vehicle charges at Thawadia check post and sanctuary gate apply; rocks can be slippery—wear good footwear.,P_00107,21.873,4.4,Narmada (near Ekta Nagar),waterfall,,,50,09:00-17:00,,,,,India,,"nature, trek, wildlife"
,10:00-17:00,"A landmark museum complex inside Sayaji Baug, established in 1894 under Maharaja Sayajirao Gaekwad III, noted for Indo-Saracenic architecture and rich collections spanning Indian and European art, archaeology, ethnography, an Egyptian mummy, and a blue whale skeleton.",10:00-17:00,2025-09-01,"Egyptian mummy, Akota bronzes, covered bridge-linked picture gallery",,,,,,,,,"['Sayaji Baug (Kamati Baug)', 'Sardar Patel Planetarium', 'Laxmi Vilas Palace']",,73.1812,,10,,,10:00-17:00,,"{'wheelchair': True, 'public_transport': True, 'parking': True}",,120,10:00-17:00,,Closed,,Baroda Museum and Picture Gallery,"Nov, Dec, Jan, Feb, Mar",5,10:00-17:00,Gujarat,,Photography generally restricted inside; plan 2–3 hours to see both museum and picture gallery.,P_00108,22.3072,4.5,Vadodara (Baroda),museum,,,10,10:00-17:00,,,,,India,,"art, history, natural history"
,06:30-20:30,"A unique Shiva temple within the Indian Army’s EME School campus, famed for its geodesic dome clad in aluminium and symbolism that blends elements of multiple faiths, with a garden displaying over a hundred historic stone sculptures.",06:30-20:30,2025-09-01,"geodesic aluminium dome, multi-faith architectural symbols, army-managed campus serenity",,,,,,,,,"['Sayaji Baug (Kamati Baug)', 'Baroda Museum & Picture Gallery', 'Laxmi Vilas Palace']",,73.192,,0,,,06:30-20:30,,"{'wheelchair': True, 'public_transport': True, 'parking': True}",,45,06:30-20:30,,06:30-20:30,,EME Temple (Dakshinamurthy & Navgraha Temple),"Nov, Dec, Jan, Feb, Mar",0,06:30-20:30,Gujarat,,Government photo ID usually required for entry due to army premises; modest attire advised; some sources note varying visitor timings and occasional restrictions.,P_00109,22.3314,4.6,Vadodara (Baroda),temple,,,0,06:30-20:30,,,,,India,,"spiritual, modern architecture, army-managed"
,06:00-18:00,"A seasonal waterfall in the Jambughoda–Pavagadh belt, famed for lush monsoon greenery, a cave-side shrine to Hathni Mata, and a rock at the base resembling a baby elephant.",06:00-18:00,2025-09-01,"monsoon cascade, cave shrine, elephant-shaped rock",,,,,,,,,"['Champaner–Pavagadh Archaeological Park', 'Jambughoda Wildlife Sanctuary', 'Kadana Dam']",,73.653,,10,,,06:00-18:00,,"{'wheelchair': False, 'public_transport': False, 'parking': True}",,120,06:00-18:00,,06:00-18:00,,Hathni Mata Waterfall,"Jul, Aug, Sep, Oct",10,06:00-18:00,Gujarat,,Roads are narrow and weekends get crowded; rocks are slippery—wear good footwear; facilities are basic—carry water and snacks.,P_00110,22.459,4.3,Shivrajpur (near Pavagadh/Champaner),waterfall,,,10,06:00-18:00,,,,,India,,"nature, monsoon, trek"
,08:00-17:00,A large open-design zoological park near the Statue of Unity featuring indigenous and exotic fauna across themed zones with golf-cart circuits and a vast walk-through aviary.,08:00-17:00,2025-09-01,"open-design habitats, walk-through aviary, proximity to Statue of Unity",,,,,,,,,"['Statue of Unity', 'Valley of Flowers', 'Zarwani Waterfalls']",,73.736,,200,,,08:00-17:00,,"{'wheelchair': True, 'public_transport': True, 'parking': True}",,180,08:00-17:00,,Closed,,Sardar Patel Zoological Park (Jungle Safari),"Nov, Dec, Jan, Feb, Mar",125,08:00-17:00,Gujarat,,Expect significant walking; golf carts available; separate camera charges may apply; arrive early for active animal sightings.,P_00111,21.838,4.3,Ekta Nagar (Kevadia),zoo,,,200,08:00-17:00,,,,,India,,"wildlife, safari, family"
,09:00-18:00,"A premier public university founded in 1949 evolving from the 1881 Baroda College, renowned for English-medium instruction, 14+ faculties, and iconic Indo-Saracenic architecture including the Arts Faculty dome modeled on Gol Gumbaz.",Closed,2025-09-01,"Indo-Saracenic Arts Faculty dome, English-medium state university, Performing Arts and Fine Arts legacy",,,,,,,,,"['Sayaji Baug (Kamati Baug)', 'Baroda Museum & Picture Gallery', 'Laxmi Vilas Palace']",,73.186,,0,,,Closed,,"{'wheelchair': True, 'public_transport': True, 'parking': True}",,60,09:00-18:00,,09:00-18:00,,The Maharaja Sayajirao University of Baroda (MSU),"Nov, Dec, Jan, Feb, Mar",0,09:00-18:00,Gujarat,,Academic campus; some buildings require permission for entry; best viewed during working hours; festivals and convocations may affect access.,P_00112,22.3099,4.5,Vadodara (Baroda),university,,,0,09:00-18:00,,,,,India,,"education, heritage, architecture"
,"04:30-13:00,16:00-21:00","A prominent ISKCON temple in the Gotri/Harni Nagar area dedicated to Sri Sri Radha Shyamasundar, known for daily aartis, kirtans, a peaceful gardened campus, and vibrant festival celebrations including Janmashtami and Rath Yatra.","04:30-13:00,16:00-21:00",2025-09-01,"Radha–Krishna darshan, devotional aartis and kirtans, festival celebrations",,,,,,,,,"['Sursagar Lake', 'Sayaji Baug (Kamati Baug)', 'Laxmi Vilas Palace']",,73.1527,,0,,,"04:30-13:00,16:00-21:00",,"{'wheelchair': True, 'public_transport': True, 'parking': True}",,45,"04:30-13:00,16:00-21:00",,"04:30-13:00,16:00-21:00",,ISKCON Baroda (Sri Sri Radha Shyamasundar Mandir),"Nov, Dec, Jan, Feb, Mar",0,"04:30-13:00,16:00-21:00",Gujarat,,Modest attire recommended; temple shop and prasadam available; timings may extend on festival days.,P_00113,22.3079,4.6,Vadodara (Baroda),temple,,,0,"04:30-13:00,16:00-21:00",,,,,India,,"spiritual, Krishna, community"
,06:00-18:00,"A river-island on the Narmada famed for a sprawling banyan grove associated with Saint Kabir, featuring thousands of prop roots forming a vast canopy and a Kabir temple reached by a short boat ride from Shuklatirth.",06:00-18:00,2025-09-01,"vast banyan canopy, Kabir temple, boat access from Shuklatirth",,,,,,,,,"['Shuklatirth', 'Mangleshwar Mahadev', 'Golden Bridge (Bharuch)']",,73.1401,,0,,,06:00-18:00,,"{'wheelchair': False, 'public_transport': True, 'parking': True}",,120,06:00-18:00,,06:00-18:00,,Kabirvad,"Nov, Dec, Jan, Feb",0,06:00-18:00,Gujarat,,Access by local boats; avoid peak monsoon when river is turbulent; carry water and cash for ferry and basic facilities.,P_00114,21.7634,4.4,Bharuch (Shuklatirth),island,,,0,06:00-18:00,,,,,India,,"nature, pilgrimage, banyan"
,06:00-20:00,Historic Indo-Saracenic municipal market building housing civic offices with active vegetable and flower bazaars.,06:00-20:00,2025-09-01,"Indo-Saracenic facade, wholesale vegetables, flower market",,,,,,,,,"['Laxmi Vilas Palace', 'Sayaji Baug']",,73.2015,,0,,,06:00-20:00,,"{'wheelchair': False, 'public_transport': True, 'parking': True}",,60,06:00-20:00,,06:00-20:00,,Khanderao Market,"Nov, Dec, Jan, Feb, Mar",0,06:00-20:00,Gujarat,,Most lively in the early morning; some vendors may close on Amavasya.,P_00115,22.2966,4.4,Vadodara,market,,,0,06:00-20:00,,,,,India,,"architecture, heritage, vegetables, flowers, photography"
,Closed,"19th-century Gaekwad royal palace showcasing Italian Renaissance–influenced design, later used by the Indian Air Force.",Closed,2025-09-01,"Italian Renaissance architecture, Gaekwad dynasty history",,,,,,,,,"['Laxmi Vilas Palace', 'Sayaji Baug']",,73.209,,0,,,Closed,,"{'wheelchair': False, 'public_transport': True, 'parking': True}",,45,Closed,,Closed,,Makarpura Palace,"Nov, Dec, Jan, Feb, Mar",0,Closed,Gujarat,,Premises are under Indian Air Force; exterior can be viewed from outside only.,P_00116,22.2475,4.2,Vadodara,heritage,,,0,Closed,,,,,India,,"architecture, history, photography"
,09:00-19:00,"Also known as Aurobindo Nivas, this ashram in Dandia Bazar was Sri Aurobindo’s residence (1894–1906) and now houses a library, meditation halls, and a small bookstore.",09:00-19:00,2025-09-01,"Sri Aurobindo relics, meditation halls, spiritual literature",,,,,,,,,"['Laxmi Vilas Palace', 'Sayaji Baug']",,73.2026,,0,,,09:00-19:00,,"{'wheelchair': False, 'public_transport': True, 'parking': True}",,60,09:00-19:00,,09:00-19:00,,Aurobindo Ashram,"Nov, Dec, Jan, Feb, Mar",0,09:00-19:00,Gujarat,,Maintain silence in meditation areas; footwear may need to be removed at entrances.,P_00117,22.302,4.4,Vadodara,spiritual,,,0,09:00-19:00,,,,,India,,"meditation, history, library, photography"
,06:00-18:00,"Late 16th-century Mughal-era mausoleum of Qutb-ud-din Muhammad Khan and his son Naurang Khan, set on a high octagonal platform with arches and jali work.",06:00-18:00,2025-09-01,"octagonal platform, Mughal arches, stone jali work",,,,,,,,,"['Laxmi Vilas Palace', 'Sayaji Baug']",,73.207,,0,,,06:00-18:00,,"{'wheelchair': False, 'public_transport': True, 'parking': True}",,45,06:00-18:00,,06:00-18:00,,Hazira Maqbara,"Nov, Dec, Jan, Feb, Mar",0,06:00-18:00,Gujarat,,Often quiet; best visited in cooler hours; stepwell across the road once supplied garden water.,P_00118,22.278,4.3,Vadodara,heritage,,,0,06:00-18:00,,,,,India,,"architecture, history, photography"
,06:00-17:30,"Shallow freshwater lake and wetland habitat famed for migratory and resident waterbirds including flamingos, pelicans, and sarus cranes.",06:00-17:30,2025-09-01,"migratory birds, Ramsar wetland, lakeside sunrise",,,,,,,,,"['Nal Sarovar Bird Sanctuary', 'Indroda Nature Park']",,72.403,,50,,,06:00-17:30,,"{'wheelchair': False, 'public_transport': True, 'parking': True}",,120,06:00-17:30,,06:00-17:30,,Thol Bird Sanctuary,"Nov, Dec, Jan, Feb",50,06:00-17:30,Gujarat,,Arrive at sunrise for peak bird activity; binoculars and telephoto lenses recommended; limited shade along trails.,P_00119,23.141,4.5,Mehsana,nature,,,200,06:00-17:30,,,,,India,,"birdwatching, nature, wetlands, photography"
,10:00-17:30,"Museum within the Lakshmi Vilas Palace Estate showcasing royal collections, including a large gallery of Raja Ravi Varma paintings, European art, and Oriental artifacts.",10:00-17:30,2025-09-01,"Raja Ravi Varma paintings, European Renaissance and Rococo art, toy train exhibit",,,,,,,,,"['Laxmi Vilas Palace', 'Sayaji Baug']",,73.1938,,80,,,10:00-17:30,,"{'wheelchair': False, 'public_transport': True, 'parking': True}",,90,10:00-17:30,,Closed,,Maharaja Fatehsingh Museum,"Nov, Dec, Jan, Feb, Mar",50,10:00-17:30,Gujarat,,Photography is not allowed inside; closed on Mondays and select public holidays.,P_00120,22.2921,4.6,Vadodara,museum,,,200,10:00-17:30,,,,,India,,"art, history, royal, photography"
,"05:00-12:00,16:00-21:00","Indo-Saracenic court building near Sursagar Lake, inaugurated in 1896 by Sayajirao Gaekwad III and famed for its central hall and statue of Maharani Chimnabai.","05:00-12:00,16:00-21:00",2025-09-01,"Indo-Saracenic design, Maharani Chimnabai statue, historic court",,,,,,,,,"['Sursagar Lake', 'Laxmi Vilas Palace']",,73.2015,,0,,,"05:00-12:00,16:00-21:00",,"{'wheelchair': False, 'public_transport': True, 'parking': False}",,30,"05:00-12:00,16:00-21:00",,"05:00-12:00,16:00-21:00",,Nyaya Mandir,"Nov, Dec, Jan, Feb, Mar",0,"05:00-12:00,16:00-21:00",Gujarat,,Facade viewing from outside is common; interiors may be restricted due to court/renovation status.,P_00121,22.2966,4.4,Vadodara,heritage,,,0,"05:00-12:00,16:00-21:00",,,,,India,,"architecture, history, photography"
,06:00-18:00,"Protected dry deciduous forest with rolling hills, two reservoirs (Kada and Targol), and fauna including leopards, sloth bears, nilgai, and diverse birdlife.",06:00-18:00,2025-09-01,"Kada reservoir, Targol reservoir, leopard sightings",,,,,,,,,"['Champaner-Pavagadh Archaeological Park', 'Jambughoda Palace']",,73.733,,50,,,06:00-18:00,,"{'wheelchair': False, 'public_transport': True, 'parking': True}",,180,06:00-18:00,,06:00-18:00,,Jambughoda Wildlife Sanctuary,"Nov, Dec, Jan, Feb, Mar",20,06:00-18:00,Gujarat,,Forest rest house at Kada; permits/checkposts may be required; early morning offers best wildlife activity.,P_00122,22.366,4.4,Panchmahal,nature,,,200,06:00-18:00,,,,,India,,"wildlife, forest, trekking, photography"
,06:00-18:00,"Small Shiva temple on the southern bank of Saputara Lake, known for a serene setting, black granite Shivlinga, and daily aarti.",06:00-18:00,2025-09-02,"lakeside setting, morning/evening aarti, peaceful ambience",,,,,,,,,"['Saputara Lake', 'Lake Garden']",,73.752,,0,,,06:00-18:00,,"{'wheelchair': False, 'public_transport': True, 'parking': True}",,30,06:00-18:00,,06:00-18:00,,Nageshwar Mahadev Temple,"Oct, Nov, Dec, Jan, Feb",0,06:00-18:00,Gujarat,,Visit at sunrise or sunset for aarti and tranquil views; footwear to be removed before entry.,P_00123,20.58,4.4,Saputara,spiritual,,,0,06:00-18:00,,,,,India,,"temple, meditation, photography, lakeside"
,06:00-21:00,"Scenic hill-station lake surrounded by gardens and walking paths, popular for pedal and row boating with lively evening ambiance.",06:00-21:00,2025-09-02,"boating, evening lights, lakeside gardens",,,,,,,,,"['Lake Garden', 'Sunset Point']",,73.752,,0,,,06:00-21:00,,"{'wheelchair': False, 'public_transport': True, 'parking': True}",,90,06:00-21:00,,06:00-21:00,,Saputara Lake,"Aug, Sep, Oct, Nov, Dec, Jan",0,06:00-21:00,Gujarat,,Boating typically available till early evening; evenings are pleasant and lively along the promenade.,P_00124,20.5789,4.5,Saputara,nature,,,0,06:00-21:00,,,,,India,,"boating, family, photography, walks"
,09:00-19:00,"Community-run cultural center showcasing tribal arts and crafts like Warli painting, bamboo work, pottery, and jewelry, with hands-on workshops and sales.",09:00-19:00,2025-09-02,"Warli paintings, bamboo crafts, tribal workshops",,,,,,,,,"['Saputara Lake', 'Nageshwar Mahadev Temple']",,73.7479,,0,,,09:00-19:00,,"{'wheelchair': False, 'public_transport': True, 'parking': True}",,60,09:00-19:00,,09:00-19:00,,Artist Village,"Aug, Sep, Oct, Nov, Dec, Jan",0,09:00-19:00,Gujarat,,Located opposite Saputara Lake; workshops often available; cash or UPI typically accepted for craft purchases.,P_00125,20.5798,4.5,Saputara,cultural,,,0,09:00-19:00,,,,,India,,"tribal art, workshops, handicrafts, photography"
,08:30-17:00,"17th-century hill fort near Saputara on the Maharashtra–Gujarat border, attributed to Chhatrapati Shivaji Maharaj, offering panoramic Sahyadri views and rock-cut cisterns Ganga–Jamuna.",08:30-17:00,2025-09-02,"hill trek, Sahyadri vistas, Ganga–Jamuna cisterns",,,,,,,,,"['Saputara Lake', 'Artist Village']",,73.7609,,0,,,08:30-17:00,,"{'wheelchair': False, 'public_transport': True, 'parking': True}",,120,08:30-17:00,,08:30-17:00,,Hatgadh Fort,"Aug, Sep, Oct, Nov, Dec, Jan",0,08:30-17:00,Maharashtra,,Trek via Hatgad village; steps can be slippery in monsoon; carry water and start early for cooler weather.,P_00126,20.5427,4.4,Hatgad,heritage,,,0,08:30-17:00,,,,,India,,"trekking, history, views, photography"
,06:00-19:00,Twin hilltop viewpoints on opposite ridges offering panoramic Western Ghats vistas—Sunrise (Valley View) for dawn hues and Sunset (Gandhi Shikhar) for evening skylines over Saputara.,06:00-19:00,2025-09-02,"panoramic valley views, ropeway access to sunset ridge, monsoon mists",,,,,,,,,"['Saputara Lake', 'Ropeway (Table Point)']",,73.7485,,0,,,06:00-19:00,,"{'wheelchair': False, 'public_transport': True, 'parking': True}",,90,06:00-19:00,,06:00-19:00,,Sunrise and Sunset Point,"Aug, Sep, Oct, Nov, Dec, Jan",0,06:00-19:00,Gujarat,,Arrive 30–45 minutes early; modest uphill walk (1–1.5 km) from parking; ropeway typically operates daytime for Sunset ridge.,P_00127,20.568,4.5,Saputara,nature,,,0,06:00-19:00,,,,,India,,"viewpoints, hiking, photography, sunrise, sunset"
,08:00-18:00,"Moist deciduous forest in the Dangs with dense teak and bamboo, interlaced by the Purna River, known for leopards, deer, rich birdlife, and high monsoon rainfall.",08:00-18:00,2025-09-02,"dense teak-bamboo forests, Purna River, birdwatching",,,,,,,,,"['Vansda National Park', 'Saputara']",,73.7,,20,,,08:00-18:00,,"{'wheelchair': False, 'public_transport': True, 'parking': True}",,180,08:00-18:00,,08:00-18:00,,Purna Wildlife Sanctuary,"Oct, Nov, Dec, Jan, Feb",10,08:00-18:00,Gujarat,,Entry permits/check-post formalities may apply; Mahal Eco Campsite has limited facilities; best wildlife activity at dawn and dusk.,P_00128,20.91,4.5,Dang,nature,,,200,08:00-18:00,,,,,India,,"wildlife, forest, birdwatching, trekking"
,07:00-17:00,"Compact 24 sq km tropical moist deciduous forest along the Ambika River with dense teak-bamboo canopy, rich birdlife, and occasional sightings of leopard, four-horned antelope, and hyena.",07:00-17:00,2025-09-02,"dense evergreen-like canopy, Ambika River, birdwatching",,,,,,,,,"['Kilad Campsite', 'Gira Waterfalls']",,73.467,,50,,,07:00-17:00,,"{'wheelchair': False, 'public_transport': True, 'parking': True}",,180,07:00-17:00,,07:00-17:00,,Vansda National Park,"Oct, Nov, Dec, Jan, Feb, Mar",20,07:00-17:00,Gujarat,,Entry formalities at the Vansda–Waghai gate; guides recommended; start early for wildlife activity and cooler temperatures.,P_00129,20.733,4.5,Navsari,nature,,,200,07:00-17:00,,,,,India,,"wildlife, forest, birdwatching, trekking"
,08:00-17:00,"Seasonal 30–75 ft cascade near Waghai at Wanarchond, dropping into the Ambika River, popular as a monsoon and post-monsoon picnic stop en route to Saputara.",08:00-17:00,2025-09-02,"monsoon flow, misty spray, picnic huts",,,,,,,,,"['Waghai Botanical Garden', 'Vansda National Park']",,73.5,,0,,,08:00-17:00,,"{'wheelchair': False, 'public_transport': True, 'parking': True}",,90,08:00-17:00,,08:00-17:00,,Gira Waterfalls,"Jul, Aug, Sep, Oct, Nov",0,08:00-17:00,Gujarat,,Waterfall is seasonal and may be dry outside monsoon; short 1 km walk from parking; swimming typically not allowed; small stalls sell snacks and bamboo handicrafts.,P_00130,20.744,4.5,Dang,nature,,,0,08:00-17:00,,,,,India,,"waterfall, photography, picnic, monsoon"
,10:00-17:00,"Government-run museum established in 1970 showcasing Dang tribal heritage with 400+ artifacts including costumes, jewelry, musical instruments, and ritual objects.",10:00-17:00,2025-09-02,"Dang tribal exhibits, traditional costumes, musical instruments",,,,,,,,,"['Saputara Lake', 'Artist Village']",,73.7519,,5,,,10:00-17:00,,"{'wheelchair': False, 'public_transport': True, 'parking': True}",,60,10:00-17:00,,10:00-17:00,,Saputara Tribal Museum,"Aug, Sep, Oct, Nov, Dec, Jan",2,10:00-17:00,Gujarat,,Photography policies may vary; plan 30–60 minutes; located near the main road opposite the lake.,P_00131,20.5799,4.4,Saputara,museum,,,50,10:00-17:00,,,,,India,,"tribal culture, history, artifacts, photography"
,06:00-19:30,"Elevated vantage on the Table Land ridge offering panoramic views of Saputara town, lake, and surrounding Dang hills; lively with casual activities and stalls.",06:00-19:30,2025-09-02,"city panoramas, table land activities, evening views",,,,,,,,,"['Saputara Lake', 'Sunset Point']",,73.7475,,0,,,06:00-19:30,,"{'wheelchair': False, 'public_transport': True, 'parking': True}",,60,06:00-19:30,,06:00-19:30,,Townview Point,"Aug, Sep, Oct, Nov, Dec, Jan",0,06:00-19:30,Gujarat,,Short uphill walk from parking; evenings are popular and can be crowded; basic snacks and viewpoints telescopes available seasonally.,P_00132,20.5725,4.4,Saputara,nature,,,0,06:00-19:30,,,,,India,,"viewpoints, hiking, photography, family"
,Closed,"Terraced hillside garden on Table Land Road with flower beds, bonsai displays, kids’ play area, and viewpoints over Saputara.","08:00-12:00,15:00-19:00",2025-09-02,"terraced flower beds, bonsai corner, hill views",,,,,,,,,"['Saputara Lake', 'Rose Garden']",,73.7478,,10,,,"08:00-12:00,15:00-19:00",,"{'wheelchair': False, 'public_transport': True, 'parking': True}",,45,"08:00-12:00,15:00-19:00",,"08:00-12:00,15:00-19:00",,Step Garden,"Mar, Apr, Jul, Aug, Sep, Oct, Nov, Dec, Jan",10,"08:00-12:00,15:00-19:00",Gujarat,,Most colorful during bloom seasons; short uphill walk with steps; small snack kiosk may operate in evenings.,P_00133,20.5785,4.2,Saputara,nature,,,10,"08:00-12:00,15:00-19:00",,,,,India,,"garden, family, photography, walks"
,08:00-17:00,"Forest Department–managed nursery showcasing flowering plants, creepers, fruit trees, and medicinal species in a serene lakeside setting with benches and shaded paths.",08:00-17:00,2025-09-02,"hibiscus varieties, lakeside ambience, botanical displays",,,,,,,,,"['Saputara Lake', 'Step Garden']",,73.7508,,0,,,08:00-17:00,,"{'wheelchair': False, 'public_transport': True, 'parking': True}",,45,08:00-17:00,,08:00-17:00,,Forest Nursery,"Aug, Sep, Oct, Nov, Dec, Jan",0,08:00-17:00,Gujarat,,Primarily for government propagation; plant purchases may be limited; most pleasant during monsoon and cool months.,P_00134,20.5798,4.2,Saputara,nature,,,0,08:00-17:00,,,,,India,,"garden, flora, walks, photography"
,06:00-18:00,"Natural amphitheater near Sunrise Point where sound reflects between hills, offering valley views and a short, quiet walk through greenery.",06:00-18:00,2025-09-02,"audible echo effect, quiet valley views",,,,,,,,,"['Sunrise Point', 'Saputara Lake']",,73.7579,,0,,,06:00-18:00,,"{'wheelchair': False, 'public_transport': True, 'parking': True}",,45,06:00-18:00,,06:00-18:00,,Echo Point,"Aug, Sep, Oct, Nov, Dec, Jan",0,06:00-18:00,Gujarat,,Echo audibility varies with weather and crowds; signage may be limited—ask locals if unsure; carry water and watch footing in monsoon.,P_00135,20.5851,4.1,Saputara,nature,,,0,06:00-18:00,,,,,India,,"viewpoints, hiking, photography, echo"
,09:00-18:00,"Compact landscaped garden near the museum featuring beds of seasonal roses in multiple varieties, with lawns, pathways, and benches for a relaxed stroll.",09:00-18:00,2025-09-02,"varieties of roses, quiet lawns",,,,,,,,,"['Saputara Tribal Museum', 'Step Garden']",,73.7509,,0,,,09:00-18:00,,"{'wheelchair': False, 'public_transport': True, 'parking': True}",,30,09:00-18:00,,09:00-18:00,,Rose Garden,"Aug, Sep, Oct, Nov, Dec, Jan",0,09:00-18:00,Gujarat,,Bloom quality varies by season; best during and after monsoon or in spring; basic seating and shade available.,P_00136,20.5796,4.1,Saputara,nature,,,0,09:00-18:00,,,,,India,,"garden, family, photography, walks"
,"09:00-13:00,14:00-19:00","Also known as Pushpak Ropeway, a cable car linking Table Land/Sunset Point with Sunrise Point over the Saputara valley and lake, offering short scenic rides.","09:00-13:00,14:00-19:00",2025-09-02,"sunset rides, lake and valley views, short gondola trip",,,,,,,,,"['Sunset Point', 'Table Land (Governor’s Hill)']",,73.7353,,80,,,"09:00-13:00,14:00-19:00",,"{'wheelchair': True, 'public_transport': True, 'parking': True}",,60,"09:00-13:00,14:00-19:00",,"09:00-13:00,14:00-19:00",,Saputara Ropeway,"Aug, Sep, Oct, Nov, Dec, Jan",80,"09:00-13:00,14:00-19:00",Gujarat,,Typical ride 5–10 minutes each way; queues on weekends/holidays; operations may pause during bad weather; carry cash/UPI and plan around sunset.,P_00137,20.576,4.4,Saputara,activity,,,80,"09:00-13:00,14:00-19:00",,,,,India,,"ropeway, viewpoints, photography, family"
,09:00-20:00,"Lakeside landscaped park with lawns, flower beds, walking paths, benches, and a children’s play area offering relaxed views of Saputara Lake.",09:00-20:00,2025-09-02,"lakefront lawns, family picnics, evening strolls",,,,,,,,,"['Saputara Lake', 'Step Garden']",,73.7509,,0,,,09:00-20:00,,"{'wheelchair': False, 'public_transport': True, 'parking': True}",,45,09:00-20:00,,09:00-20:00,,Lake Garden,"Mar, Apr, Jul, Aug, Sep, Oct, Nov, Dec, Jan",0,09:00-20:00,Gujarat,,Shaded seating; livelier in evenings; bloom and greenery are best in monsoon and spring.,P_00138,20.5796,4.3,Saputara,nature,,,0,09:00-20:00,,,,,India,,"garden, family, photography, walks"
,06:00-19:00,"Quiet hill station in the Dangs around Don village, offering cool climate, rolling Sahyadri hills, lush monsoon greenery, and rustic tribal countryside vistas.",06:00-19:00,2025-09-02,"monsoon vistas, quiet viewpoints, tribal countryside",,,,,,,,,"['Saputara', 'Gira Waterfalls']",,73.686,,0,,,06:00-19:00,,"{'wheelchair': False, 'public_transport': True, 'parking': True}",,120,06:00-19:00,,06:00-19:00,,Don Hill Station,"Jul, Aug, Sep, Oct, Nov, Dec, Jan",0,06:00-19:00,Gujarat,,Roads can be foggy and slippery in monsoon; limited facilities—carry water and snacks; start early for clear views.,P_00139,20.777,4.4,Ahwa,nature,,,0,06:00-19:00,,,,,India,,"hill station, views, trekking, photography"
