entry_fee_foreign_inr,open_hours_tue,description,open_hours_sat,last_verified,famous_for,access,entry_fee_child_indian_inr,connectivity,district,distance_from,visitor_tips,tips,seasonal_hours,nearby_attractions,suitable_for,lng,food_specialties,entry_fee_adult,aka,entry_fee_adult_indian_inr,open_hours_sun,stay_and_food,accessibility,taluka,avg_visit_mins,open_hours_fri,entry_fee_camera_fee_inr,open_hours_mon,temple,name,best_months,entry_fee_child,open_hours_wed,state,location,notes,id,lat,rating,city,type,village,disclaimer,entry_fee_foreign,open_hours_thu,festival_crowds,heritage,fees,darshan_timings,country,highlights,tags
,10:00-17:00,"A sprawling 75-acre water park and resort set amid greenery in Amipura, Mehsana district, just off the Ahmedabad-Mehsana highway. Featuring high-adrenaline slides, wave pool, splash pad, lazy river, rain dance, children's areas, and a resort offering cottages, suites, and restaurants; also hosts large weddings and corporate events.",10:00-17:00,2025-09-01,"variety of water slides, wave pool, resort stay & cottages, wedding/events venue",,,,,,,,,"['Sun Temple Modhera', 'Bahucharaji Temple', 'Mehsana city']","['family', 'kids', 'group', 'friends', 'wedding', 'corporate']",72.4139,,1000,,,10:00-17:00,,"{'wheelchair': True, 'public_transport': True, 'parking': True}",,300,10:00-17:00,,10:00-17:00,,Shanku’s Water Park (Shanku's Water World Resort),"Mar, Apr, May, Sep, Oct",1000,10:00-17:00,Gujarat,,"Entry fee Rs. 1000 (Mon–Sat), Rs. 1200 (Sun). Swimsuits available for rent; lockers, towels, food options on site. Weekends, school vacations, and holidays are peak times—arrive early. Easy to reach by highway bus, cab, or private car. Resort stay bookable separately.",P_00049,23.7865,4.2,Mehsana (near Ahmedabad),amusement_park,,,1000,10:00-17:00,,,,,India,,"water park, resort, family, rides, events, destination"
,10:00-17:00,"A 12‑acre water and amusement park on Sarkhej–Sanand Road (Telav–Kolat area) offering 25+ water slides and attractions including a wave pool, lazy river, aqua dance, artificial waterfall, and a small amusement section that typically operates in the evening slot.",10:00-17:00,2025-09-01,"wave pool, artificial waterfall, lazy river, aqua dance",,,,,,,,,"['Sarkhej Roza', 'Maniar’s Wonderland', 'Prahladnagar eateries', 'Vastrapur Lake']","['family', 'kids', 'friends', 'group']",72.4575,,600,,,10:00-17:00,,"{'wheelchair': True, 'public_transport': 'partial', 'parking': True}",,240,10:00-17:00,,10:00-17:00,,Splash The Fun World,"Mar, Apr, May, Sep, Oct",500,10:00-17:00,Gujarat,,"Some sources report intermittent closures or operational changes; confirm current status, timings, and pricing before visiting. Amusement rides may run in a separate evening window with per‑ride charges; swimwear, locker, and food services available on site.",P_00050,22.973,4.1,Ahmedabad,amusement_park,,,600,10:00-17:00,,,,,India,,"water park, rides, family, wave pool, lazy river"
,10:30-17:30,"A large water and adventure park set along the Gandhinagar–Mahudi Highway at Amarapur, featuring big slides like Mississippi and Safe Cyclone, wave pool, rain dance, artificial waterfall, fog and snowfall zones, kids’ areas, cafeteria, and event facilities within an expansive green campus.",10:30-17:30,2025-09-01,"Mississippi slide, wave pool, rain dance, snow/fog zones, large green campus",,,,,,,,,"['Amarnath Dham (Amarapur)', 'Gandhinagar Akshardham', 'Indroda Nature Park', 'Modhera Sun Temple']","['family', 'kids', 'friends', 'group', 'school trips', 'corporate outings']",72.7075,,500,,,10:30-17:30,,"{'wheelchair': True, 'public_transport': 'partial', 'parking': True}",,300,10:30-17:30,,10:30-17:30,,Swapna Srushti Water Park,"Mar, Apr, May, Sep, Oct, Nov, Feb",400,10:30-17:30,Gujarat,,"Swimsuits, lockers, and towels available on rent; weekends and holidays are peak—arrive early. Operating details and prices may change seasonally; verify current status before visiting.",P_00051,23.2416,4.1,Amarapur (near Gandhinagar/Ahmedabad),amusement_park,,,500,10:30-17:30,,,,,India,,"water park, family, rides, wave pool, day outing"
,06:00-17:30,"Gujarat’s largest wetland bird reserve about 64–70 km from Ahmedabad, centered on a 120.8 sq km shallow lake and marshes with 36+ islets, noted for winter migratory flocks of flamingos, pelicans, ducks, geese, storks, herons, and over 250 species; declared a sanctuary in 1969 and a Ramsar site in 2012.",06:00-17:30,2025-09-01,"migratory flamingos and pelicans, country boat safaris, sunrise birding, vast shallow wetlands",,,,,,,,,"['Vadla Wetland', 'Lothal (Harappan site)', 'Thol Bird Sanctuary', 'Bagodara']","['birders', 'photographers', 'nature', 'family', 'solo', 'group']",72.033,,50,,,06:00-17:30,,"{'wheelchair': 'partial', 'public_transport': False, 'parking': True}",,180,06:00-17:30,,06:00-17:30,,Nal Sarovar Bird Sanctuary,"Nov, Dec, Jan, Feb",30,06:00-17:30,Gujarat,,"Arrive at sunrise for peak sightings; boat rides are paid separately (shared and private options); carry binoculars, water, sun protection; amenities are basic and cash is useful; operations can vary seasonally and on busy weekends.",P_00052,22.767,4.6,Nalsarovar (near Ahmedabad),nature,,,100,06:00-17:30,,,,,India,,"bird sanctuary, wetland, Ramsar site, boating, birdwatching"
,06:00-20:00,"A vast seasonal salt marsh in the Thar Desert, famed for its blindingly white salt flats stretching to the horizon, surreal sunsets and full‑moon nights, and winter cultural festival (Rann Utsav) showcasing Kutchi crafts, music, and dance; typically accessed via Dhordo, north of Bhuj.",06:00-20:00,2025-09-01,"endless white salt flats, full‑moon glow, Rann Utsav cultural fair, sunset views, mirror‑like wet salt pans post‑monsoon",,,,,,,,,"['Kala Dungar (Black Hill)', 'Kalo Dungar Dattatreya Temple', 'Banni Grasslands', 'Kutch Desert Wildlife Sanctuary', 'Bhuj city (Aina Mahal, Prag Mahal)']","['photographers', 'couples', 'family', 'solo', 'group', 'culture seekers', 'nature']",69.46,,100,,,06:00-20:00,,"{'wheelchair': 'partial', 'public_transport': False, 'parking': True}",,180,06:00-20:00,,06:00-20:00,,Great Rann of Kutch (White Desert),"Nov, Dec, Jan, Feb",50,06:00-20:00,Gujarat,,"Entry requires a simple online/on‑site permit (carry ID); surfaces are glaringly bright—bring sunglasses, hat, sunscreen, and water. Best experienced at sunset or on full‑moon nights. Roads can be restricted in monsoon when the flats are waterlogged.",P_00053,23.83,4.8,Dhordo (near Bhuj),nature,,,100,06:00-20:00,,,,,India,,"salt desert, white rann, Rann Utsav, sunset, full moon, photography, culture"
,06:00-18:00,"Among India’s largest protected areas (~7,506 sq km) spanning the Great Rann’s seasonal saline wetlands and salt flats; famed for ‘Flamingo City’ breeding grounds of greater flamingos, fossil-rich ‘bets’ (island hills) like Khadir, and proximity to the Harappan site of Dholavira; civilian access to northern sectors requires special permits due to the international border.",06:00-18:00,2025-09-01,"Flamingo breeding (Flamingo City), vast seasonal saline wetlands, desert and mudflats vistas, proximity to Dholavira",,,,,,,,,"['Dholavira (UNESCO World Heritage)', 'Great Rann of Kutch (Dhordo–White Desert)', 'Kala Dungar (Black Hill)', 'Banni Grasslands']","['birders', 'photographers', 'nature', 'adventurers', 'researchers']",70.44,,250,,,06:00-18:00,,"{'wheelchair': 'partial', 'public_transport': False, 'parking': True}",,240,06:00-18:00,,06:00-18:00,,Kutch Desert Wildlife Sanctuary,"Nov, Dec, Jan, Feb",150,06:00-18:00,Gujarat,,"Seasonally inundated; transforms to salt desert after Oct–Nov as waters recede. Northern reaches beyond India Bridge require security permissions; plan logistics from Bhuj/Khavda or Dholavira. Carry water, sun protection, binoculars, and ID. Local conditions, access gates, and fee schedules can change—confirm before travel.",P_00054,23.91,4.7,Kutch (Great Rann region; access via Bhuj/Khavda),nature,,,1200,06:00-18:00,,,,,India,,"wildlife sanctuary, salt desert, Flamingo City, Rann, birding, desert"
,09:00-18:00,"A UNESCO World Heritage archaeological site on Khadir Bet island in the Great Rann of Kutch, showcasing one of the largest and best‑preserved Harappan cities with a citadel, middle and lower town, sophisticated reservoirs and drainage, gateways, ceremonial grounds, and a cemetery with varied burial types.",09:00-18:00,2025-09-01,"massive water reservoirs, urban planning (citadel–middle–lower town), stone architecture, Harappan signboard with large glyphs, nearby site museum",,,,,,,,,"['Kutch Desert Wildlife Sanctuary', 'Great Rann of Kutch (White Desert)', 'Kala Dungar (Black Hill)', 'Fossil Park Khadirbet']","['history-buffs', 'educational', 'photographers', 'solo', 'group', 'families']",70.2136,,40,,,09:00-18:00,,"{'wheelchair': False, 'public_transport': False, 'parking': True}",,180,09:00-18:00,,09:00-18:00,,Dholavira (Harappan City),"Nov, Dec, Jan, Feb, Mar",0,09:00-18:00,Gujarat,,"Remote desert location; carry water, sun protection, and cash. Best light in morning/late afternoon; limited shade and amenities on-site. Permits/checkposts may apply when approaching via certain Rann routes; verify road conditions in monsoon.",P_00055,23.8886,4.8,Khadirbet (near Dholavira village),archaeological_site,,,600,09:00-18:00,,,,,India,,"Indus Valley Civilization, Harappan, UNESCO, archaeology, water management"
,06:00-18:30,"A striking river‑carved canyon of sandstone and shale about 35–40 km from Bhuj, nicknamed the Grand Canyon of Gujarat for its layered, wind‑and‑water sculpted gorges, seasonal pools, and vivid rock strata; access typically involves a short off‑road jeep ride from the parking area.",06:00-18:30,2025-09-01,"layered rock formations, mini grand canyon views, sunset photography, seasonal waterfall/pools",,,,,,,,,"['Bhuj (Aina Mahal, Prag Mahal)', 'Great Rann of Kutch (Dhordo)', 'Kutch Desert Wildlife Sanctuary', 'Kala Dungar']","['photographers', 'trekkers', 'nature', 'friends', 'solo', 'group']",69.584,,20,,,06:00-18:30,,"{'wheelchair': False, 'public_transport': False, 'parking': True}",,120,06:00-18:30,,06:00-18:30,,Kadiya Dhro (Grand Canyon of Kutch),"Nov, Dec, Jan, Feb",0,06:00-18:30,Gujarat,,"Local jeeps/guides operate from the last motorable point; expect bumpy off‑road sections. Wear sturdy shoes and avoid cliff edges. Water levels and a small waterfall appear in/after monsoon; occasional crocodile presence reported in pools—do not enter water. Carry water, sun protection, and cash.",P_00056,23.258,4.6,Near Kodki/Ulat (Bhuj),nature,,,20,06:00-18:30,,,,,India,,"canyon, geology, trekking, photography, offbeat"
200,"09:00-12:00,15:00-18:00","An 18th‑century palace in Darbargadh, Bhuj, famed for its mirror‑inlaid interiors, blue Delft tiles, chandeliers and European decorative arts blended with Kutchi craftsmanship; built under Rao Lakhpatji and designed by master artisan Ram Singh Malam, today functioning as a museum adjacent to Prag Mahal.","09:00-12:00,15:00-18:00",2025-09-01,,,0,,Kutch,,,"['Plan 45–75 minutes for galleries; combine with Prag Mahal next door', 'Low‑light interiors—phones work fine; avoid flash if restricted', 'Mid‑morning or late‑afternoon visits offer softer interior lighting', 'Carry cash for local tickets and small camera fee if applicable']",,"['Prag Mahal', 'Bhujodi craft village', 'Kutch Museum', 'Hamirsar Lake', 'Great Rann of Kutch (Dhordo)']","['history-buffs', 'photographers', 'families', 'students', 'solo', 'groups']",69.664,,,,20,"09:00-12:00,15:00-18:00",,"{'wheelchair': 'partial', 'parking': True, 'restrooms': True, 'guides_available': True}",,60,"09:00-12:00,15:00-18:00",50,"09:00-12:00,15:00-18:00",,Aina Mahal (Palace of Mirrors),"Nov, Dec, Jan, Feb, Mar",,"09:00-12:00,15:00-18:00",Gujarat,,Timings and ticket amounts can change during holidays or maintenance; limited air‑conditioning inside galleries—summer afternoons can be warm.,P_00057,23.246,4.6,Bhuj,heritage_palace_museum,,,,Closed,,,,,India,"['Hall of Mirrors and gilded mirror panels', 'Audience Hall, Pleasure Hall, Darbar Hall', 'European clocks, mechanical toys, ceramics and glassware displays', 'Restoration after 2001 earthquake; museum galleries open to visitors']","heritage, museum, architecture, Indo-European, 18th century"
,,"Anjar is among the oldest towns in Kutch (traditionally dated to the 7th century), known for historic temples and shrines, the Jesal–Toral Samadhi, and a living tradition of metal and craft markets; it sits about 40 km southeast of Bhuj and 25–30 km from Kandla/Mundra corridors.",,2025-09-01,,,,"{'nearest_city': 'Bhuj', 'nearest_airport': 'Bhuj (BHJ)', 'rail': 'Anjar Railway Station (links to Bhuj, Gandhidham, Ahmedabad)', 'road': 'Good road links to Bhuj, Gandhidham, Kandla, Mundra'}",Kutch,,,,,"['Bhuj (Aina Mahal, Prag Mahal, Kutch Museum)', 'Mandvi (Vijay Vilas Palace, beach)', 'Great Rann of Kutch (Dhordo)', 'Kutch Desert Wildlife Sanctuary', 'Jesal Toral fair and local temple circuits']","['culture-seekers', 'families', 'pilgrims', 'history-buffs', 'solo', 'group']",70.026,"['dabeli', 'local Gujarati thali', 'Kutchi snacks']",,,,,,"{'wheelchair': 'partial', 'public_transport': True, 'parking': True}",,120,,,,,Anjar,"Nov, Dec, Jan, Feb, Mar",,,Gujarat,,Summer is very hot; winter is pleasant for temple visits and walks. Many shrines observe modest dress and photography norms. Local markets are best explored on foot; carry cash for small purchases.,P_00058,23.113,,,town,,,,,,,,,India,"['Jesal–Toral Samadhi (central spiritual landmark)', 'Madhavrai and Bhareswar Mahadev temples', 'Ajaypal/Ajepal shrines and Pinjora Pir dargah', 'Local bazaars with metalwork and daily-use handicrafts', 'Annual fairs and folk traditions tied to Jesal–Toral lore']","heritage, temples, handicrafts, Jesal-Toral, history"
,,"Historic pilgrimage village centered on the Desh Devi Ashapura Mata Temple, the patron deity of Kutch and the kuldevi of the former Jadeja rulers; attracts large footfalls during Navratri with special arrangements for yatris and extended darshan hours.",,2025-09-01,,,,,Kutch,"{'bhuj_km': 100, 'rann_of_kutch_dhordo_km': 120, 'narayan_sarovar_km': 60, 'koteshwar_temple_km': 62}",,,,"['Narayan Sarovar', 'Koteshwar Mahadev Temple', 'Lakhpat Fort and Gurudwara', 'Great Rann of Kutch (White Desert)', 'Bhuj (Aina Mahal, Prag Mahal)']","['pilgrims', 'families', 'culture_seekers', 'history_buffs', 'solo', 'groups']",68.94,,,,,,"{'dharmashala_camps': 'available during Navratri; basic shared halls and rooms managed by trust', 'local_eateries': 'simple Gujarati meals and snacks near the temple precinct'}","{'wheelchair': 'partial', 'public_transport': True, 'parking': True, 'roads': 'good highway access; village approach can be busy during festivals'}",Lakhpat,60,,,,"{'deity': 'Ashapura Mata (Desh Devi)', 'aarti_timings': {'mangla_darshan': '05:00', 'dhoop_aarti': '09:00', 'sandhya_aarti': 'At sunset'}, 'festival_highlights': ['Ashvin Navratri', 'Chaitra Navratri'], 'facilities': ['shoe-keeping stalls', 'drinking water', 'rest areas', 'pilgrim camps during Navratri']}",Mata no Madh (Ashapura Mata Temple),"Oct, Nov, Dec, Jan, Feb, Mar",,,Gujarat,,Expect very large crowds during Ashvin Navratri; carry modest attire and cash for offerings; check current darshan schedule before travel.,P_00059,23.54,,,temple_town,Mata no Madh,,,,,,,,India,,"pilgrimage, Ashapura Mata, Navratri, heritage, Kutch"
,10:00-17:00,"Gujarat’s oldest museum (est. 1877) opposite Hamirsar Lake, displaying Kutch archaeology, textiles, tribal ethnography, numismatics, and the famed seven‑tusked wooden Airavat sculpture.",10:00-17:00,2025-09-01,"oldest museum of Gujarat, Airavat seven‑tusked elephant, Kshatrapa inscriptions collection",,,,,,,,,,,69.6664,,20,,,10:00-17:00,,,,60,10:00-17:00,,10:00-17:00,,Kutch Museum,"Nov, Dec, Jan, Feb, Mar",0,Closed,Gujarat,,Closed on Wednesdays and some public holidays; carry cash for tickets and optional camera fee; combine visit with nearby Aina Mahal and Prag Mahal.,P_00060,23.2486,4.5,Bhuj,museum,,,,10:00-17:00,,,,,India,,"heritage, museum, textiles, epigraphy, ethnography"
,00:00-24:00,"A 450-year-old man-made lake at the heart of Bhuj, built under Rao Khengarji I and revived after the 2001 earthquake; popular for lakeside walks, views of nearby Aina Mahal and Prag Mahal, and the monsoon overflow tradition with thanksgiving puja.",00:00-24:00,2025-09-01,"central city oasis, Rajendra Park island garden, heritage walk views",,,,,,,,,,,69.664,,0,,,00:00-24:00,,,,45,00:00-24:00,,00:00-24:00,,Hamirsar Lake,"Oct, Nov, Dec, Jan, Feb, Mar",0,00:00-24:00,Gujarat,,"Evenings are pleasant for strolls; carry water in summer; combine with Aina Mahal, Prag Mahal, and Kutch Museum nearby.",P_00061,23.251,4.4,Bhuj,lake,,,,00:00-24:00,,,,,India,,"heritage, lake, walks, picnic, sunset"
,06:00-18:00,"A small protected grassland near Naliya dedicated to conserving the critically endangered Great Indian Bustard, also hosting harriers, eagles, foxes, and hyenas in semi‑arid scrub and fields.",06:00-18:00,2025-09-01,"Great Indian Bustard sightings, raptors and grassland birds, semi-arid landscapes",,,,,,,,,,,68.714,,0,,,06:00-18:00,,,,90,06:00-18:00,,06:00-18:00,,Kutch Bustard Sanctuary (Lala–Parjan),"Nov, Dec, Jan, Feb",0,06:00-18:00,Gujarat,,Carry binoculars; maintain distance from wildlife; early morning and late afternoon offer best chances for sightings; access and viewing may require local guidance.,P_00062,23.219,4.4,Naliya (near Jakhau),nature,,,,06:00-18:00,,,,,India,,"birding, bustard, grassland, wildlife, photography"
,00:00-23:59,"Seasonal desert festival in the White Rann at Dhordo featuring tent stays, folk performances, crafts, and moonlit salt‑desert views.",00:00-23:59,2025-09-01,"full-moon desert views, folk music and dance",,,,,,,,,"['Bhuj', 'Kalo Dungar']",,69.7167,,0,,,00:00-23:59,,"{'wheelchair': True, 'public_transport': True, 'parking': True}",,1440,00:00-23:59,,00:00-23:59,,Rann Utsav (Kutch),"Nov, Dec, Jan, Feb",0,00:00-23:59,Gujarat,,Season typically runs late Oct to early Mar; plan around full‑moon nights; permits/checkpoints apply for White Rann access.,P_00063,23.7333,4.6,Dhordo (Kutch),festival,,,0,00:00-23:59,,,,,India,,"culture, desert, photography"
,00:00-23:59,"A wide sandy shoreline on the Arabian Sea near Mandvi town, known for calm waters, sunsets, camel rides, and food stalls.",00:00-23:59,2025-09-01,"sunset views, camel and ATV rides",,,,,,,,,"['Vijay Vilas Palace', '72 Jinalaya (Bauter Jainalay)']",,69.3524,,0,,,00:00-23:59,,"{'wheelchair': False, 'public_transport': True, 'parking': True}",,120,00:00-23:59,,00:00-23:59,,Mandvi Beach,"Nov, Dec, Jan, Feb, Mar",0,00:00-23:59,Gujarat,,Weekends get crowded; evenings best for breeze and sunset; basic amenities and food stalls available.,P_00064,22.8333,4.4,Mandvi (Kutch),beach,,,0,00:00-23:59,,,,,India,,"sunset, water sports, photography"
,09:30-12:15,"A 19th-century palace in Bhuj known for its Italian Gothic–influenced architecture, grand Durbar Hall, and clock tower.",09:30-12:15,2025-09-01,"Durbar Hall, clock tower views",,,,,,,,,"['Aina Mahal', 'Hamirsar Lake']",,69.6683,,50,,,09:30-12:15,,"{'wheelchair': False, 'public_transport': True, 'parking': True}",,60,09:30-12:15,,09:30-12:15,,Prag Mahal,"Nov, Dec, Jan, Feb, Mar",20,09:30-12:15,Gujarat,,Often has an additional afternoon slot 15:00-17:45; modest dress and photography etiquette recommended.,P_00065,23.2548,4.4,Bhuj,heritage,,,200,09:30-12:15,,,,,India,,"architecture, history, photography"
,06:00-19:00,Highest point in Kutch with panoramic views of the White Rann and a 400-year-old Dattatreya temple.,06:00-19:00,2025-09-01,"sunset views over White Rann, Dattatreya temple rituals",,,,,,,,,"['India Bridge', 'Dhordo (White Rann)']",,69.8139,,0,,,06:00-19:00,,"{'wheelchair': False, 'public_transport': False, 'parking': True}",,90,06:00-19:00,,06:00-19:00,,Kala Dungar (Black Hill),"Nov, Dec, Jan, Feb, Mar",0,06:00-19:00,Gujarat,,Army jurisdiction area near border; photography may be restricted toward military zones; evenings offer best visibility.,P_00066,23.9342,4.5,Khavda (near Bhuj),viewpoint,,,0,06:00-19:00,,,,,India,,"scenic, temple, photography"
,00:00-23:59,"Major seaport on the Gulf of Kutch, officially Deendayal Port, handling high cargo volumes for western and northern India.",00:00-23:59,2025-09-01,"largest cargo volumes, natural tidal harbour",,,,,,,,,"['Gandhidham', 'Kandla Creek']",,70.2209,,0,,,00:00-23:59,,"{'wheelchair': True, 'public_transport': True, 'parking': True}",,60,00:00-23:59,,00:00-23:59,,Kandla Port (Deendayal Port),"Nov, Dec, Jan, Feb, Mar",0,00:00-23:59,Gujarat,,Restricted operational area; visitor access typically limited to authorized personnel or arranged tours/official visits.,P_00067,23.0003,4.4,Gandhidham (Kandla),port,,,0,00:00-23:59,,,,,India,,"maritime, cargo, industry"
,00:00-23:59,"India’s largest private commercial port and leading container hub on the Gulf of Kutch, operated within a port-based SEZ.",00:00-23:59,2025-09-01,"largest container throughput, deep-draft all-weather port",,,,,,,,,"['Mandvi Beach', 'Shri Mundra Dargah']",,69.7,,0,,,00:00-23:59,,"{'wheelchair': True, 'public_transport': True, 'parking': True}",,60,00:00-23:59,,00:00-23:59,,Mundra Port,"Nov, Dec, Jan, Feb, Mar",0,00:00-23:59,Gujarat,,Restricted operational area; access requires authorization or official arrangements; photography may be restricted in sensitive zones.,P_00068,22.746,4.5,Mundra (Kutch),port,,,0,00:00-23:59,,,,,India,,"maritime, cargo, industry"
,07:00-19:00,"A 1920s red-sandstone summer palace of the Kutch royals near Mandvi, noted for Rajput and Indo-Saracenic elements and sea-view terraces.",07:00-19:00,2025-09-01,"roof terrace sea views, red-sandstone jalis and domes",,,,,,,,,"['Mandvi Beach', '72 Jinalaya (Bauter Jainalay)']",,69.3439,,50,,,07:00-19:00,,"{'wheelchair': False, 'public_transport': True, 'parking': True}",,90,07:00-19:00,,07:00-19:00,,Vijay Vilas Palace,"Nov, Dec, Jan, Feb, Mar",20,07:00-19:00,Gujarat,,Portions may be a royal residence; photography usually allowed in exterior areas; combine with sunset at Mandvi Beach.,P_00069,22.8267,4.5,Mandvi (Kutch),heritage,,,200,07:00-19:00,,,,,India,,"architecture, history, photography"
,06:00-20:00,"A sacred lake and temple complex at the western edge of Kutch, revered as one of Hinduism’s Panch Sarovar and located near Koteshwar Mahadev.",06:00-20:00,2025-09-01,"Panch Sarovar status, Lakshmi-Narayan and Trikamray temples",,,,,,,,,"['Koteshwar Mahadev Temple', 'Narayan Sarovar Wildlife Sanctuary']",,68.5386,,0,,,06:00-20:00,,"{'wheelchair': False, 'public_transport': False, 'parking': True}",,90,06:00-20:00,,06:00-20:00,,Narayan Sarovar,"Nov, Dec, Jan, Feb, Mar",0,06:00-20:00,Gujarat,,Remote border-side location; limited public transport; fairs held in Chaitra and Kartik draw large pilgrim crowds.,P_00070,23.6751,4.4,Narayan Sarovar (Lakhpat),pilgrimage,,,0,06:00-20:00,,,,,India,,"temple, lake, history"
,06:00-18:30,"Open-jeep safari inside Gir National Park’s western range, a 3-hour guided trail offering chances to spot Asiatic lions, leopards, deer, and rich birdlife.",06:00-18:30,2025-09-01,"Asiatic lion sightings, guided jeep routes",,,,,,,,,"['Devaliya Safari Park', 'Crocodile Breeding Centre']",,70.796,,0,,,06:00-18:30,,"{'wheelchair': False, 'public_transport': True, 'parking': True}",,180,06:00-18:30,,06:00-18:30,,Jeep Safari in Gir Jungle Trail (Gir West),"Nov, Dec, Jan, Feb, Mar",0,06:00-18:30,Gujarat,,Safaris run in fixed slots (morning/midday/evening); advance online permit booking is mandatory; closed during monsoon (typically mid-Jun to mid-Oct).,P_00071,21.124,4.6,Sasan Gir,wildlife,,,0,06:00-18:30,,,,,India,,"safari, wildlife, photography"
,07:00-17:55,A fenced 4.12-sq-km interpretation zone near Sasan Gir offering short bus and jeep safaris with high chances of viewing Asiatic lions and other Gir fauna.,07:00-17:55,2025-09-01,"lion sightings, bus and jeep safaris",,,,,,,,,"['Gir Jungle Trail (Sasan Gir)', 'Somnath Temple']",,70.7,,0,,,07:00-17:55,,"{'wheelchair': False, 'public_transport': True, 'parking': True}",,60,07:00-17:55,,07:00-17:55,,Devalia Safari Park (Gir Interpretation Zone),"Nov, Dec, Jan, Feb, Mar",0,closed,Gujarat,,Hourly bus safaris and fixed jeep slots; online permits required; typically closed on Wednesdays; peak visibility in mornings and late afternoons.,P_00072,21.12,4.5,Sasan Gir,wildlife,,,0,07:00-17:55,,,,,India,,"safari, wildlife, photography"
,06:00-18:00,"Guided nature trails and birding sessions around Sasan Gir’s forest edge and riparian zones, targeting over 250–300 resident and migratory species along with interpretive natural history.",06:00-18:00,2025-09-01,"Indian pitta sightings, Crested Serpent Eagle and owls",,,,,,,,,"['Gir Jungle Trail', 'Devalia Safari Park']",,70.802,,0,,,06:00-18:00,,"{'wheelchair': False, 'public_transport': True, 'parking': True}",,120,06:00-18:00,,06:00-18:00,,Gir Nature Walks & Birdwatching,"Nov, Dec, Jan, Feb",0,06:00-18:00,Gujarat,,Most walks operate at dawn and late afternoon with naturalists; binoculars essential; prime birding months are Nov–Feb when migrants arrive.,P_00073,21.136,4.6,Sasan Gir,wildlife,,,0,06:00-18:00,,,,,India,,"nature walk, birdwatching, photography"
